{
  "schema_version": "decision_record.v1",
  "decision_id": "DEC-P3-dvc-medium-calibration-v1",
  "revision": 2,
  "decision_kind": "execution",
  "subject": "phase3_dvc_medium_calibration",
  "authority_level": "L2",
  "parent_decision_id": "DEC-P3-provider-free-refreeze-v1",
  "supersedes_decision_id": null,
  "statement": "Replace the operator-mutated public dependency environment before launch and retain the approved DVC instance, mode order, and paid execution ceilings unchanged.",
  "selected_option": "discard the zero-provider-call v1 environment and bind the calibration to the clean v2 environment authority",
  "alternatives": [
    {
      "option": "accept the mutated v1 dependency tree",
      "rejected_reason": "Its content no longer matched the frozen authority, so accepting it would defeat fail-closed environment identity."
    },
    {
      "option": "recompute the v1 authority over generated bytecode",
      "rejected_reason": "The bytecode came from an operator probe after extraction and is not part of the pinned image environment."
    },
    {
      "option": "cancel the approved calibration",
      "rejected_reason": "No provider call or scored execution occurred, and clean rematerialization from the same pinned image restores the frozen boundary."
    }
  ],
  "rationale": "Provider-free bundle construction recomputed the public dependency tree and rejected 114 generated pytest bytecode files. A clean extraction from the unchanged digest-pinned image reproduced the original 29211-file, 718828719-byte tree. Only the host source path and therefore the enclosing authority digest changed. This is infrastructure recovery before launch, not an experimental treatment change.",
  "scope": [
    "instance:iterative__dvc_2.19.0_2.20.0",
    "discarded_public_environment:e755332f552785b0d280f39ab6d210bfed5384a07ebdbcaf6b02ea51af250e49",
    "discarded_partial_bundle:/tmp/agentteam-phase3-dvc-medium-live-bundle-v1",
    "discarded_provider_calls:0",
    "replacement_public_environment:207b85049bcedc4a80469a6757faed992d928b29a8297270f60de23af924c830",
    "dependency_tree_sha256:74ca5474275a1051ed4d396e8f977c9c48cfeb93e95421fd788c5bffb57ad75c",
    "dependency_tree_files:29211",
    "dependency_tree_bytes:718828719",
    "per_mode_token_ceiling:600000",
    "aggregate_token_ceiling:1800000"
  ],
  "expected_outcome": "Use only the clean v2 public dependency authority for provider-free replay and any later model execution.",
  "acceptance_refs": [
    "plans/2026-08-16-phase3-dvc-medium-calibration.md",
    "the replacement tree validates immediately before bundle publication",
    "the replacement image digest equals the revision 1 pinned image digest",
    "no provider evidence exists under the discarded partial bundle",
    "all revision 1 task, model, mode-order, and budget fields remain unchanged"
  ],
  "status": "active",
  "created_at": "2026-08-16T03:18:00Z",
  "created_by": "operator-semantic-authority",
  "previous_revision_sha256": "d669da8fa3b15dea49d4d79b900742c4043ab7488ec1cf40737fca1b439aa546"
}
