{
  "schema_version": "decision_record.v1",
  "decision_id": "DEC-P3-requests-cumulative-context-retest-v1",
  "revision": 2,
  "decision_kind": "acceptance",
  "subject": "phase3_requests_cumulative_context_retest",
  "authority_level": "L2",
  "parent_decision_id": "DEC-P3-cumulative-context-budget-v1",
  "supersedes_decision_id": null,
  "statement": "Close the bounded Requests retest as positive cost-containment evidence but reject the common 16-call boundary as sufficient for Phase 3 expansion because direct mode could not reserve post-patch verification and full mode produced an evaluator-incompatible candidate test change.",
  "selected_option": "retain all three terminal outcomes, keep Phase 3 expansion unauthorized, and require a provider-free role-aware verification reserve plus a preregistered benchmark candidate-test policy before another scored instance",
  "alternatives": [
    {
      "option": "accept the common 16-call policy and proceed directly to a new SWE-EVO instance",
      "rejected_reason": "Direct mode exhausted all 16 admitted tools after editing and returned a failed result without post-patch verification."
    },
    {
      "option": "raise the common hard limit immediately from this single sample",
      "rejected_reason": "One Requests repetition does not calibrate a general fixed limit, and a larger undifferentiated boundary would weaken the containment result without reserving verification explicitly."
    },
    {
      "option": "strip the full-mode test hunk after execution and report an official quality score",
      "rejected_reason": "Post-hoc candidate mutation is outside the frozen protocol and would invalidate the scored result."
    }
  ],
  "rationale": "The retest completed all three serial modes with 100 percent provider-usage coverage and 853231 aggregate tokens, 59.7962 percent below the retained 2122262-token historical baseline and 71.9525 percent below the previous 3042089-token treatment screen. Single used 201242 tokens and 8 tools. Direct used 259457 tokens and exactly 16 tools, but its worker correctly failed because the hard boundary arrived before post-patch tests; no candidate was integrated and the evaluator classified the empty submission as candidate_patch_invalid. Full used 392532 tokens across a 4-tool author and 15-tool worker, passed common acceptance, and emitted a substantive production fix, but its added test overlapped the evaluator-only test patch and was rejected as evaluator_patch_conflict. Cost containment is therefore demonstrated on this historical control, while end-to-end quality and the shared hard-limit policy are not accepted.",
  "scope": [
    "instance:psf__requests_v2.12.2_v2.12.3",
    "runtime_release:phase3-calibration-82cf953",
    "runtime_commit:82cf95332c9d612749aca2ec8d7dcb54424f38aa",
    "authorized_bundle:66dd5f04ac05a25907575efa2f3bebbaa26286590dc15a070128e478959ffc19",
    "run_root:/tmp/agentteam-phase3-requests-cumulative-context-retest-v1-run-v2",
    "pilot_state_sha256:8e0cbb132667a816be5c10a19bfeec696a7f2ba051c1e1aabed9939594100ac0",
    "launched_modes:single_codex,agentteam_direct,agentteam_full",
    "aggregate_total_tokens:853231",
    "single_total_tokens:201242",
    "direct_total_tokens:259457",
    "full_total_tokens:392532",
    "direct_failure:candidate_patch_invalid_after_tool_budget_exhaustion",
    "full_failure:evaluator_patch_conflict",
    "phase3_expansion:not_authorized"
  ],
  "expected_outcome": "Use the retained run to design and provider-free verify a role-aware budget that protects final verification and a benchmark candidate-test policy that remains fixed before model execution; do not claim a quality improvement from this run.",
  "acceptance_refs": [
    "reports/2026-08-14-phase3-requests-cumulative-context-retest.md",
    "provider usage coverage: 4/4 invocations complete",
    "aggregate provider usage: total=853231 input=832810 cached_input=650752 output=20421 reasoning=5127",
    "single official quality: fail_to_pass=0/4 pass_to_pass=104/109 partial=0.290826",
    "direct outcome: candidate_patch_invalid after 16 completed tools and no post-patch verification",
    "full outcome: common acceptance passed, official evaluator rejected evaluator_patch_conflict",
    "all resource-session cleanup records report cleanup_complete=true"
  ],
  "status": "completed",
  "created_at": "2026-08-14T12:24:28Z",
  "created_by": "operator-semantic-authority",
  "previous_revision_sha256": "7b7d83f31d881c245c0b9173573ca45e5000bc98bdf18592319dd06efba398bf"
}
