{
  "schema_version": "decision_record.v1",
  "decision_id": "DEC-P3-input-cost-causal-screen-v1",
  "revision": 1,
  "decision_kind": "execution",
  "subject": "phase3_input_cost_containment",
  "authority_level": "L2",
  "parent_decision_id": null,
  "supersedes_decision_id": null,
  "statement": "Run one bounded historical-control screen on the retained Requests SWE-EVO instance to measure the Phase 3 model-context policy.",
  "selected_option": "one repetition of single_codex, agentteam_direct, and agentteam_full under the frozen 4000-token tool-output limit and disabled web search",
  "alternatives": [
    {
      "option": "select a new SWE-EVO instance immediately",
      "rejected_reason": "Changing the task would confound the first measurement of the input-cost policy."
    },
    {
      "option": "run a contemporaneous old-policy control",
      "rejected_reason": "It would deliberately repeat the known high-cost behavior; the retained sealed run is sufficient for an engineering screen."
    },
    {
      "option": "reuse the 8000000-token-per-mode bundle",
      "rejected_reason": "That infrastructure-measurement ceiling is too broad for a cost-containment screen."
    }
  ],
  "rationale": "The retained Requests run gives a fixed historical baseline for all three modes. Holding the instance, source, model profile, public inputs, mode order, and evaluator constant provides a bounded engineering estimate of the new context policy. The result remains a historical-control screen rather than a randomized causal estimate.",
  "scope": [
    "instance:psf__requests_v2.12.2_v2.12.3",
    "baseline_bundle:ee9b336411f15a2b1cfe4a525542895f3b6e3d7f730f07477da90dee1a65edb4",
    "runtime_commit:d2f22075c8858faddc4223438c35b2a9c9b886bc",
    "mode_order:single_codex,agentteam_direct,agentteam_full",
    "per_mode_token_ceiling:1000000",
    "planned_total_token_ceiling:3000000",
    "maximum_mode_executions:3"
  ],
  "expected_outcome": "Measure whether the context policy reduces provider-reported input cost without reducing official quality, then decide whether to proceed to a new instance.",
  "acceptance_refs": [
    "all three launches use tool_output_token_limit=4000 and web_search=disabled",
    "provider usage coverage is 100 percent for every launched invocation",
    "candidate patch compatibility and official evaluator evidence are complete",
    "no corrective operator intervention occurs during a mode execution",
    "the report separates historical-control evidence from strict causal claims",
    "stop before the next mode on identity, usage, resource, or budget evidence failure"
  ],
  "status": "active",
  "created_at": "2026-08-14T07:47:32Z",
  "created_by": "operator-semantic-authority",
  "previous_revision_sha256": null
}
